{
  "provider_revision_id": "hpr_01J00000000000000000000000",
  "provider_revision_digest": "sha256:e8b675a36ae414dce65c748b549f2e6c2e1b4ddd688620d8a2e0380358b34d1c",
  "provider_instance_id": "hpi_html_anything",
  "configuration_digest": "sha256:4343434343434343434343434343434343434343434343434343434343434343",
  "approved_permissions_digest": "sha256:4444444444444444444444444444444444444444444444444444444444444444",
  "credential_binding_digest": "sha256:4646464646464646464646464646464646464646464646464646464646464646",
  "provider_kind": "skill",
  "conformance": [
    {
      "capability": "html.generate",
      "version": "1.0",
      "profile": "responsive",
      "suite_version": "1.0.0",
      "status": "passed",
      "report_digest": "sha256:4747474747474747474747474747474747474747474747474747474747474747",
      "suite_id": "capability-provider",
      "suite_digest": "sha256:261f8021c3a29cc0d21c1464ca5fa41166174c841278b6c4882459b78a86a791",
      "suite_profile_id": "capability-core-v1"
    }
  ],
  "conformance_set_digest": "sha256:b51b5afe09c1530fcc4b4cbb1519aeea75770448b02f30cf9956d62558f0fb41",
  "created_at": "2026-07-16T09:00:21Z",
  "implementation": {
    "implementation_id": "skill-provider.html-anything",
    "implementation_version": "1.0.0",
    "distribution_type": "package",
    "distribution_digest": "sha256:4242424242424242424242424242424242424242424242424242424242424242",
    "manifest_digest": "sha256:4141414141414141414141414141414141414141414141414141414141414141",
    "provenance": {
      "source_revision": "df83e9c63b9187bf4bfa0c110c280f5072fcbe4aaa86e34075bcf532ccac112a",
      "source_tree_digest": "sha256:bc28e910320da8171726b3725121cd374e750905635911d045028f18e7de94d8",
      "build_artifact_digest": "sha256:4242424242424242424242424242424242424242424242424242424242424242",
      "sbom_digest": "sha256:dbee01f2b0e31c6766c12a9621d493f7945f2ee315387114004c948cf4ad3206",
      "provenance_statement_digest": "sha256:881111bd110444243f20b9ed1ffcf190b866ecbeb7b965c2118facf74398eee7",
      "build_system": "contract-fixture-build-v1"
    }
  },
  "port": {
    "protocol": "capability-provider",
    "protocol_version": "v1",
    "contract_digest": "sha256:82ab68c671d838e1c3f0e3e31368c985c118120c8c474d21fc648e312ce7d500",
    "binding_digest": "sha256:4545454545454545454545454545454545454545454545454545454545454545"
  }
}
