{
  "provider_revision_id": "spr_01J00000000000000000000000",
  "provider_revision_digest": "sha256:0cf63bc10a3d6e979a6a729485f4bca99435868a40e9cedce335f8058ff8360f",
  "provider_instance_id": "spi_native_sandbox",
  "configuration_digest": "sha256:4444444444444444444444444444444444444444444444444444444444444444",
  "approved_permissions_digest": "sha256:5555555555555555555555555555555555555555555555555555555555555555",
  "credential_binding_digest": "sha256:7777777777777777777777777777777777777777777777777777777777777777",
  "provider_kind": "sandbox",
  "conformance": [
    {
      "capability": "sandbox.exec",
      "version": "1.0",
      "profile": "hardened",
      "suite_version": "1.0.0",
      "status": "passed",
      "report_digest": "sha256:8888888888888888888888888888888888888888888888888888888888888888",
      "suite_id": "sandbox-provider",
      "suite_digest": "sha256:bdebf6fba1cd41072a46b47de451bf039485047e9a9478fad2d6c69ee8ff38b7",
      "suite_profile_id": "sandbox-core-v1"
    }
  ],
  "conformance_set_digest": "sha256:07f488c6a212045ad548c2c040f67f25e04674774682890135e4aca3fd7ad17a",
  "created_at": "2026-07-16T09:00:00Z",
  "implementation": {
    "implementation_id": "sandbox-provider.native",
    "implementation_version": "0.8.2",
    "distribution_type": "oci_image",
    "distribution_digest": "sha256:2222222222222222222222222222222222222222222222222222222222222222",
    "manifest_digest": "sha256:1111111111111111111111111111111111111111111111111111111111111111",
    "provenance": {
      "source_revision": "9c37e975d779c58140bb5cd9f9b8392b7cbd9e983f3bb5bfa4ea82883f8cd3fc",
      "source_tree_digest": "sha256:8f5c190d225474f8b544d443ddf4c322d8cd81d5a07ed7434bbfd98606b21cbe",
      "build_artifact_digest": "sha256:2222222222222222222222222222222222222222222222222222222222222222",
      "sbom_digest": "sha256:98f6a838792c8dfc83f6eca3151b7c666ab0a04797519905ffdb1f9656bc1d58",
      "provenance_statement_digest": "sha256:31905821d0c07873cd474cddb5cbd6ca9bf8fba00cc62079a8b6bda03a035c12",
      "build_system": "contract-fixture-build-v1"
    },
    "image_digest": "sha256:3333333333333333333333333333333333333333333333333333333333333333"
  },
  "port": {
    "protocol": "sandbox-provider",
    "protocol_version": "v1",
    "contract_digest": "sha256:173feeb61f47696778f1c457f275677fc8e5d287088094d0a3c7129c359cbe95",
    "binding_digest": "sha256:6666666666666666666666666666666666666666666666666666666666666666"
  }
}
