{
  "provider_revision_id": "tplpr_01J0000000000000000000000",
  "provider_revision_digest": "sha256:2877104d4087015fd00baa9a13c34ffb7380d36d5165e5221be5389a85b12f44",
  "provider_instance_id": "tpli_html_anything",
  "configuration_digest": "sha256:8383838383838383838383838383838383838383838383838383838383838383",
  "approved_permissions_digest": "sha256:8484848484848484848484848484848484848484848484848484848484848484",
  "credential_binding_digest": "sha256:8686868686868686868686868686868686868686868686868686868686868686",
  "provider_kind": "template",
  "conformance": [
    {
      "capability": "template.html.generate",
      "version": "1.0",
      "profile": "landing-page",
      "suite_version": "1.0.0",
      "status": "passed",
      "report_digest": "sha256:8787878787878787878787878787878787878787878787878787878787878787",
      "suite_id": "capability-provider",
      "suite_digest": "sha256:87070d107edb785270c9e2c7b50ed775362b39e0262f319232f56093a2e1225d",
      "suite_profile_id": "capability-core-v1"
    }
  ],
  "conformance_set_digest": "sha256:9512b4f12af069f19a59c392ca5d15f94c7068534906d23dee8e868873fbeb50",
  "created_at": "2026-07-16T09:00:25Z",
  "implementation": {
    "implementation_id": "template-provider.html-anything",
    "implementation_version": "1.0.0",
    "distribution_type": "static_catalog",
    "distribution_digest": "sha256:8282828282828282828282828282828282828282828282828282828282828282",
    "manifest_digest": "sha256:8181818181818181818181818181818181818181818181818181818181818181",
    "provenance": {
      "source_revision": "fff069561c01646b12e35cc9b75a06e76f805e8e6c1e9e7e5099d3ddaf1d5644",
      "source_tree_digest": "sha256:1020243e50e91b511e76859472575ed5f8e3fe4e6c5ed1a45f37bb5f66b98219",
      "build_artifact_digest": "sha256:8282828282828282828282828282828282828282828282828282828282828282",
      "sbom_digest": "sha256:024bb69402a12a518c4216765c28f889ad0fc10ba6fc837cf1c87fa2900bbaec",
      "provenance_statement_digest": "sha256:267e79f31d8b644a5982b132baf74b780293aa98c209979c52953b6f8bdfc702",
      "build_system": "contract-fixture-build-v1"
    }
  },
  "port": {
    "protocol": "capability-provider",
    "protocol_version": "v1",
    "contract_digest": "sha256:343f4f6aee161db54b083204d9fe45684e77e7a69dabea7ecdc69b3688e0c0b7",
    "binding_digest": "sha256:8585858585858585858585858585858585858585858585858585858585858585"
  }
}
