{
  "provider_revision_id": "rpr_01J00000000000000000000000",
  "provider_revision_digest": "sha256:22202069681233773cf41d807cbd431e6a29177e94de5303fb21a5da4e60e222",
  "provider_instance_id": "rpi_html_preview",
  "configuration_digest": "sha256:3838383838383838383838383838383838383838383838383838383838383838",
  "approved_permissions_digest": "sha256:3939393939393939393939393939393939393939393939393939393939393939",
  "credential_binding_digest": "sha256:3b3b3b3b3b3b3b3b3b3b3b3b3b3b3b3b3b3b3b3b3b3b3b3b3b3b3b3b3b3b3b3b",
  "provider_kind": "renderer",
  "conformance": [
    {
      "capability": "artifact.preview.html",
      "version": "1.0",
      "profile": "default",
      "suite_version": "1.0.0",
      "status": "passed",
      "report_digest": "sha256:3c3c3c3c3c3c3c3c3c3c3c3c3c3c3c3c3c3c3c3c3c3c3c3c3c3c3c3c3c3c3c3c",
      "suite_id": "capability-provider",
      "suite_digest": "sha256:9ca84761cf924f8f0f6b03bc1943dc6722fb1b54fccc1dd6d125d52004afdd90",
      "suite_profile_id": "capability-core-v1"
    }
  ],
  "conformance_set_digest": "sha256:6a917cbb4d1fc2d3fc384506e8ef732c6eacf7f8e8410dce0446289bab281f27",
  "created_at": "2026-07-16T09:00:22Z",
  "implementation": {
    "implementation_id": "renderer-provider.html-preview",
    "implementation_version": "1.0.0",
    "distribution_type": "package",
    "distribution_digest": "sha256:3737373737373737373737373737373737373737373737373737373737373737",
    "manifest_digest": "sha256:3636363636363636363636363636363636363636363636363636363636363636",
    "provenance": {
      "source_revision": "2251cca58dd51fcc8576ed01cde49988693c245328d08664970b53b202b7059b",
      "source_tree_digest": "sha256:de324776ca2fc656a882554433228bf24a5261c8edad31faa0d2ce0d2b4d5198",
      "build_artifact_digest": "sha256:3737373737373737373737373737373737373737373737373737373737373737",
      "sbom_digest": "sha256:0e16c0107b1b6a20c3c89ee5280e028b8adc9ffbf914c3d28c60c636adc4032c",
      "provenance_statement_digest": "sha256:fdb92839e992ae3a10e6ba23b139877f2ebed04cdfc65767b4ea92a7fdeabfe8",
      "build_system": "contract-fixture-build-v1"
    }
  },
  "port": {
    "protocol": "capability-provider",
    "protocol_version": "v1",
    "contract_digest": "sha256:bc2e091e79a4f04cde57189adfbef05ee447ef4c1173754cfe0535feec2f5b62",
    "binding_digest": "sha256:3a3a3a3a3a3a3a3a3a3a3a3a3a3a3a3a3a3a3a3a3a3a3a3a3a3a3a3a3a3a3a3a"
  }
}
